{
  "$schema": "http://json-schema.org/draft-07/schema#",
  "title": "config.json",
  "description": "Pipeline configuration. Top level is closed (typos in section names fail); sections stay lenient so they can grow. Secrets are never stored here — only *_env pointers.",
  "type": "object",
  "additionalProperties": false,
  "required": ["language", "voice", "render", "paths", "defaults", "review"],
  "properties": {
    "language": { "type": "string" },
    "voice": { "type": "object" },
    "render": {
      "type": "object",
      "properties": {
        "engine": { "type": "string", "enum": ["remotion", "hyperframes", "combo"] },
        "upscale": {
          "type": "object",
          "description": "Upload size per format (2B, D-074): pipeline/04-render/finalize.mjs upscales the approved master to it after Gate 3. null = upload as rendered.",
          "additionalProperties": false,
          "properties": {
            "long": { "$ref": "#/definitions/size" },
            "short": { "$ref": "#/definitions/size" }
          }
        }
      }
    },
    "schedule": {
      "type": "object",
      "description": "Fixed publish days (3D, D-074) — pipeline/06-publish/schedule.mjs assigns each cut its slot.",
      "additionalProperties": false,
      "properties": {
        "long": { "$ref": "#/definitions/rhythm" },
        "short": { "$ref": "#/definitions/rhythm" }
      }
    },
    "paths": { "type": "object" },
    "defaults": { "type": "object" },
    "stock": { "type": "object" },
    "ai_images": { "type": "object" },
    "youtube": {
      "type": "object",
      "properties": {
        "client_secret_path_env": { "type": "string" },
        "token_path_env": { "type": "string" },
        "upload_privacy": { "type": "string", "enum": ["private", "unlisted", "public"] },
        "altered_content": { "type": "boolean" },
        "category_id": { "type": "string" },
        "made_for_kids": { "type": "boolean" }
      }
    },
    "review": {
      "type": "object",
      "required": ["script_max_loops"],
      "properties": {
        "script_max_loops": { "type": "integer", "minimum": 1 },
        "qa_autofix_technical": { "type": "boolean" },
        "qa_flag_content": { "type": "boolean" },
        "panel": {
          "type": "object",
          "required": ["score_threshold", "auto_pass_threshold", "reviewers", "weights"],
          "properties": {
            "enabled": { "type": "boolean" },
            "score_threshold": { "type": "number", "minimum": 0, "maximum": 10, "description": "Both reviewers must reach this to pass the loop (9)." },
            "auto_pass_threshold": { "type": "number", "minimum": 0, "maximum": 10, "description": "Both must reach this (+ hard gates) to skip the human script gate (9.2)." },
            "max_iterations": { "type": "integer", "minimum": 1 },
            "stages": { "type": "array", "items": { "type": "string", "enum": ["idea", "script", "scene-plan", "cut", "publish"] } },
            "reviewers": {
              "type": "array",
              "minItems": 2,
              "items": {
                "type": "object",
                "required": ["name", "provider", "model"],
                "properties": {
                  "name": { "type": "string" },
                  "provider": { "type": "string" },
                  "model": { "type": "string" },
                  "enabled": { "type": "boolean" }
                }
              }
            },
            "weights": {
              "type": "object",
              "additionalProperties": false,
              "required": ["retention_structure", "originality_depth", "hard_rule_craft", "style_tone", "readaloud_clarity"],
              "properties": {
                "retention_structure": { "type": "number" },
                "originality_depth": { "type": "number" },
                "hard_rule_craft": { "type": "number" },
                "style_tone": { "type": "number" },
                "readaloud_clarity": { "type": "number" }
              }
            },
            "stage_overrides": {
              "type": "object",
              "description": "Per-stage panel overrides (e.g. the 'idea' content-value gate runs the SAME panel with its own thresholds/weights/gates). Merged over the global panel by resolvePanelCfg.",
              "additionalProperties": {
                "type": "object",
                "properties": {
                  "score_threshold": { "type": "number", "minimum": 0, "maximum": 10 },
                  "auto_pass_threshold": { "type": "number", "minimum": 0, "maximum": 10 },
                  "required_gates": { "type": "array", "items": { "type": "string" } },
                  "weights": { "type": "object", "additionalProperties": { "type": "number" } }
                }
              }
            }
          }
        }
      }
    },
    "llm": {
      "type": "object",
      "properties": {
        "author": {
          "type": "object",
          "properties": { "provider": { "type": "string" }, "model": { "type": "string" } }
        },
        "providers": {
          "type": "object",
          "additionalProperties": {
            "type": "object",
            "required": ["kind"],
            "properties": {
              "kind": { "type": "string", "enum": ["subagent", "http"] },
              "model": { "type": "string" },
              "key_env": { "type": "string" },
              "rpm": { "type": "integer" },
              "free_tier": { "type": "boolean" },
              "enabled": { "type": "boolean" },
              "base_url": { "type": "string" }
            }
          }
        }
      }
    },
    "news": {
      "type": "object",
      "properties": {
        "enabled": { "type": "boolean" },
        "min_corroboration": { "type": "integer", "minimum": 1 },
        "dedup": { "type": "boolean" },
        "sources": {
          "type": "array",
          "items": {
            "type": "object",
            "required": ["name", "type"],
            "properties": {
              "name": { "type": "string" },
              "type": { "type": "string", "enum": ["official", "aggregator"] },
              "url": { "type": "string", "format": "uri" },
              "enabled": { "type": "boolean" }
            }
          }
        }
      }
    },
    "error": {
      "type": "object",
      "properties": {
        "retry": {
          "type": "object",
          "properties": {
            "max_attempts": { "type": "integer", "minimum": 1 },
            "backoff_ms": { "type": "integer", "minimum": 0 },
            "backoff_factor": { "type": "number", "minimum": 1 }
          }
        },
        "on_fatal": { "type": "string", "enum": ["pause_and_notify", "stop"] }
      }
    },
    "notify": {
      "type": "object",
      "properties": {
        "channel": { "type": "string", "enum": ["push", "email", "both"] },
        "email_to_env": { "type": "string" }
      }
    },
    "distribute": {
      "type": "object",
      "description": "Cross-platform distribution (D-027). SEAM defined Wave 4 / T4.3; disabled by default. The live Postiz adapter + after-upload write land in Wave 5 / T5.3.",
      "properties": {
        "enabled": { "type": "boolean" },
        "provider": { "type": "string", "enum": ["postiz", "noop"] },
        "base_url_env": { "type": "string" },
        "api_key_env": { "type": "string" },
        "channels": {
          "type": "object",
          "description": "Target channel handles per post kind (short_crosspost / link_post / pin / blog).",
          "additionalProperties": { "type": "array", "items": { "type": "string" } }
        }
      }
    }
  },
  "definitions": {
    "rhythm": {
      "type": "object",
      "additionalProperties": false,
      "required": ["weekdays"],
      "properties": {
        "weekdays": { "type": "array", "minItems": 1, "items": { "enum": ["mon", "tue", "wed", "thu", "fri", "sat", "sun"] } },
        "every_weeks": { "type": "integer", "minimum": 1, "description": "1 = every week; 2 = every second week, counted from `anchor`." },
        "anchor": { "type": "string", "pattern": "^[0-9]{4}-[0-9]{2}-[0-9]{2}$", "description": "A date in a week the rhythm runs (needed when every_weeks > 1)." }
      }
    },
    "size": {
      "type": ["object", "null"],
      "additionalProperties": false,
      "required": ["width", "height"],
      "properties": {
        "width": { "type": "integer", "minimum": 16 },
        "height": { "type": "integer", "minimum": 16 }
      }
    }
  }
}
