{
  "language": "en",
  "voice": {
    "provider": "edge-tts",
    "edge_tts": {
      "voice": "en-US-AndrewMultilingualNeural",
      "rate": "+8%",
      "pitch": "+0Hz"
    },
    "target_wpm": 160,
    "loudness_lufs": -16
  },
  "render": {
    "engine": "combo",
    "fps": 30,
    "long": { "width": 1920, "height": 1080 },
    "short": { "width": 1080, "height": 1920 },
    "upscale": { "long": { "width": 2560, "height": 1440 }, "short": null }
  },
  "schedule": {
    "long": { "weekdays": ["tue"], "every_weeks": 2, "anchor": "2026-10-27" },
    "short": { "weekdays": ["mon", "wed", "fri"], "every_weeks": 1 }
  },
  "paths": {
    "content": "content",
    "assets": "assets",
    "remotion": "templates/remotion"
  },
  "defaults": {
    "long_seconds": 360,
    "short_seconds": 55,
    "short_seconds_max": 120
  },
  "stock": {
    "pexels_enabled": true,
    "pixabay_enabled": true
  },
  "ai_images": {
    "enabled": false,
    "compute": "colab"
  },
  "youtube": {
    "client_secret_path_env": "YOUTUBE_CLIENT_SECRET_PATH",
    "token_path_env": "YOUTUBE_TOKEN_PATH",
    "upload_privacy": "private",
    "altered_content": true,
    "category_id": "27",
    "made_for_kids": false
  },
  "review": {
    "script_max_loops": 3,
    "qa_autofix_technical": true,
    "qa_flag_content": true,
    "panel": {
      "enabled": true,
      "score_threshold": 9,
      "auto_pass_threshold": 9.2,
      "max_iterations": 3,
      "stages": ["script", "scene-plan", "cut", "publish"],
      "reviewers": [
        { "name": "claude-subagent", "provider": "claude_subagent", "model": "claude-sonnet-4-6", "enabled": true },
        { "name": "gemini", "provider": "gemini", "model": "gemini-3.5-flash", "enabled": false },
        { "name": "groq", "provider": "groq", "model": "meta-llama/llama-4-scout-17b-16e-instruct", "enabled": false }
      ],
      "weights": {
        "retention_structure": 0.30,
        "originality_depth": 0.20,
        "hard_rule_craft": 0.20,
        "style_tone": 0.15,
        "readaloud_clarity": 0.15
      },
      "stage_overrides": {
        "publish": {
          "required_gates": ["accuracy", "no_overpromise", "disclosure_set"],
          "weights": {
            "title_ctr": 0.35,
            "seo_keywords": 0.25,
            "answer_first_description": 0.20,
            "metadata_consistency": 0.20
          }
        }
      }
    }
  },
  "llm": {
    "author": { "provider": "claude", "model": "claude-opus-4-8" },
    "providers": {
      "claude_subagent": { "kind": "subagent", "model": "claude-sonnet-4-6" },
      "gemini": { "kind": "http", "model": "gemini-3.5-flash", "key_env": "GEMINI_API_KEY", "rpm": 10, "free_tier": true, "enabled": false },
      "groq": { "kind": "http", "model": "meta-llama/llama-4-scout-17b-16e-instruct", "key_env": "GROQ_API_KEY", "rpm": 30, "free_tier": true, "enabled": false }
    }
  },
  "news": {
    "enabled": true,
    "min_corroboration": 1,
    "dedup": true,
    "sources": [
      { "name": "anthropic", "type": "official", "url": "https://www.anthropic.com/news", "enabled": true },
      { "name": "openai", "type": "official", "url": "https://openai.com/news/", "enabled": true },
      { "name": "google-ai", "type": "official", "url": "https://blog.google/technology/ai/", "enabled": true },
      { "name": "microsoft-ai", "type": "official", "url": "https://blogs.microsoft.com/ai/", "enabled": true },
      { "name": "meta-ai", "type": "official", "url": "https://ai.meta.com/blog/", "enabled": true },
      { "name": "the-decoder", "type": "aggregator", "url": "https://the-decoder.com/feed/", "enabled": true },
      { "name": "tldr-ai", "type": "aggregator", "url": "https://tldr.tech/api/rss/ai", "enabled": true },
      { "name": "hn", "type": "aggregator", "url": "https://hn.algolia.com/api/v1/search_by_date?tags=story&query=AI", "enabled": true }
    ]
  },
  "error": {
    "retry": { "max_attempts": 3, "backoff_ms": 2000, "backoff_factor": 2 },
    "on_fatal": "pause_and_notify"
  },
  "notify": {
    "channel": "push",
    "email_to_env": "NOTIFY_EMAIL"
  },
  "distribute": {
    "enabled": false,
    "provider": "postiz",
    "base_url_env": "POSTIZ_BASE_URL",
    "api_key_env": "POSTIZ_API_KEY",
    "channels": {
      "short_crosspost": ["youtube", "instagram", "tiktok"],
      "link_post": ["x", "facebook"]
    }
  }
}
